{
  "schema": "cap.core.binding.v1",
  "id": "binding.digest.test-report",
  "type": "digest",
  "target": "fixture://build-test/test-report-digest",
  "standard": "CAP-Digest",
  "standardVersion": "2026-07-06-draft",
  "profile": "profile.cap-digest-view.v0",
  "constraints": {
    "sourceRunEvidence": "evidence.build-test-001",
    "digestEvidenceIsRunEvidence": false
  },
  "integrity": null,
  "freshness": null,
  "status": "resolved",
  "evidenceRefs": ["evidence.build-test-001"]
}
